singlish_content,transliterated_L1,man_written
covid-19 asadithayin 178 deneku haduna ganne - yuda hamudapathi,covid - 19 අසදිතයින් 178 දෙනෙකු හදුන ගන්නෙ - යුද හමුදපති,Covid 19 ආසාදිතයින් 178 දෙනෙකු හඳුනා ගැනේ යුද හමුදාපති
thawath covid-19 asadithayin 178k wartha wei.: army commander,තවත් covid - 19 අසදිතයින් 178ක් වර්ත වෙඉ .: army commander,තවත් covid 19 ආසාදිතයින් 178ක් වාර්තාවේ army commander
podu prawahana sewa sidu karannanta leasing sadaha 04/01 sita maasa 06ka sahana kalayak dena lesa leasing ha vanija banku walata maha bankuwa danum dei,පෝදු ප්‍රවහන සෙව සිදු කරන්නන්ට ලේසින්ග් සදහ 04 / 01 සිට මාස 06ක සහන කලයක් දෙන ලෙස ලේසින්ග් හා වනිජ බන්කු වලට මහ බන්කුව දනුම් දෙඉ,පොදු ප්‍රවාහන සේවා සිදුකරන්නන්ට ලීසිං සඳහා 04/01සිට මාස හයක් සහන කාලයක් දෙන ලෙස ලීසින් හා වාණිජ බැංකුවලට මහ බැංකුව දැනුම් දෙයි
magii prawahana sewaye niyuthu wyapara ha pudgalainge kalbadhu pahasukam sandaha maasa 06ka naya..(1/2),මගී ප්‍රවහන සෙවයෙ නියුතු ව්යපර හා පුද්ගලඉන්ගෙ කල්බද්හු පහසුකම් සඳහා මාස 06ක නය ..( 1 / 2 ),මගී ප්‍රවාහන සේවය සේවයේ නියුතු ව්‍යාපාර හා පුද්ගලයින්ගේ කල්බදු පහසුකම් සඳහා මාස 6 ක ණය
"..sahana yojana kramayak laba dena lesa maha benkuwa, waanija benkuwalata haa muulya aayathanawalata danwai. (2/2)",".. සහන යෝජන ක්‍රමයක් ලබ දෙන ලෙස මහ බෙන්කුව , වානිජ බෙන්කුවලට හා මූල්ය ආයතනවලට දන්වඉ . ( 2 / 2 )",සහන යෝජනා ක්‍රමයක් ලබා දෙන ලෙස මහ බැංකුව වාණිජ බැංකුවලට හා මූල්‍ය බැංකු හා මූල්‍ය ආයතන වලට දන්වයි
(2/2)kriyathmaka karana lesa maha benkuwen benku ha muulya ayathana wetha danwai.wedidhura thorathuru sadaha piwisenna - www.adaderana.lk web adawiyata,( 2 / 2 ) ක්‍රියත්මක කරන ලෙස මහ බෙන්කුවෙන් බෙන්කු හා මූල්ය අයතන වෙත දන්වඉ . වෙදිද්හුර තෝරතුරු සදහ පිවිසෙන්න - ව්ව්ව් . අදදෙරන . ල්ක් වෙබ් අදවියට,ක්‍රියාත්මක කරන ලෙස මහ බැංකුවෙන් බැංකු හා මූල්‍ය ආයතන වෙත දන්වයි වැඩිදුර තොරතුරු සඳහා පිවිසෙන්න www.adaderana.lk වෙබ් අඩවිය
magee pravahana sewaye niyuthu pudgalayinta kalbadhu pahasukam sadaha maasa 6 k ho eeta adu kaala seemawakata naya sahana yojana kramayak(1/2),මගී ප්‍රවහන සෙවයෙ නියුතු පුද්ගලයින්ට කල්බද්හු පහසුකම් සදහ මාස 6 ක් හෝ‍ ඊට අදු කාල සීමවකට නය සහන යෝජන ක්‍රමයක් ( 1 / 2 ),මගී ප්‍රවාහන සේවයේ නියුතු පුද්ගලයින්ට කල්ප ද පහසුකම් සඳහා මාස 6ක් හෝ ඊට අඩු කාලසීමාවකට ණය සඳහා යෝජනා ක්‍රමයක්
"covid-19 asadithayin 321 deneku suwaya labai.merata suwaya labaa rohalwalin pitawa giya samastha ganana 84,969 dakwa ihalata - saukya amathyanshaya","covid - 19 අසදිතයින් 321 දෙනෙකු සුවය ලබඉ . මෙරට සුවය ලබා රෝහල්වලින් පිටව ගිය සමස්ත ගනන 84 , 969 දක්වා ඉහලට - සෞක්ය අමත්යන්ශය",Covid 19 ආසාදිතයින් 321දෙනෙකු සුවය ලබයි මෙරට සුවය ලබා රෝහල් වලින් පිටව ගියේ සමස්ත ගණන 84969දක්වා ඉහළට ඉහළට සෞඛ්‍ය අමාත්‍යාංශය
"thawath covid-19 asadithayin 321k suwaya laba pitawa yai; suwaya labu mulu sankyawa 84,968.: epid","තවත් covid - 19 අසදිතයින් 321ක් සුවය ලබ පිටව යඉ ; සුවය ලබු මුලු සන්ක්යව 84 , 968 .: එපිද්",තවත් covid 19 ආසාදිතයින් 321ක් සුවය ලබා පිටව යයි සුවය ලැබූ මුළු සංඛ්‍යාව 84968:EPID
(2/2) dna parikshanayen thahawuru wei.: police spokesman,( 2 / 2 ) ද්න පරික්ශනයෙන් තහවුරු වෙඉ .: පෝලිකෙ ස්පෝකෙස්මන්,DNA පරීක්ෂණයෙන් තහවුරු  වේ police spokesmen
"kohuwala, asiri mawathe ginigath motor rathayakin hamu-wu mala sirura, kohuwala - bathiya mawathe padinchi 33-haviridi wyaparikayage bawata (1/2)","කෝහුවල , අසිරි මවතෙ ගිනිගත් මෝටෝර් රතයකින් හමු - වු මල සිරුර , කෝහුවල - බතිය මවතෙ පදින්චි 33 - හවිරිදි ව්යපරිකයගෙ බවට ( 1 / 2 )",kohuwala ආසිරි මාවතේ ගිනකොහුවල ආසිරි මාවතේ ගිනි ගත් මෝටර් රථයකින් හමුවූ මළ සිරුර කොහුවල භාතිය මාවතේ පදිංචි 33 හැවිරිදි ව්‍යාපාරිකයෙකුගේ බවට
..kohuwala bhathiya mawathe padinchi 33 hewiridi wyaparikayage bawa dna parikshanayen thahawuru wei.-police (2/2),.. කෝහුවල බ්හතිය මවතෙ පදින්චි 33 හෙවිරිදි ව්යපරිකයගෙ බව ද්න පරික්ශනයෙන් තහවුරු වෙඉ .- පෝලිකෙ ( 2 / 2 ),කොහුවල භාතිය මාවතේ පදිංචි 33 හැවිරිදි ව්‍යාපාරිකයෝ ගේ බව DNA පරීක්ෂණයෙන් තහවුරු වෙයි පොලිස්
"kohuwaladi mortor rathayak thula thibi soyagath pilissie giya mala sirura, (1/2)","කෝහුවලදි මෝර්ටෝර් රතයක් තුළ තිබි සෝයගත් පිලිස්සී ගිය මල සිරුර , ( 1 / 2 )",කොහුවල දී මෝටර් රථයක් තුළ තිබූ සොයාගත්  පිළිස්සී ගිය මළ සිරුර
(2/2)mtv/sirasa ta erehiwa panawa ethi waarana niyogaya colamba disa adhikaranayen thawaduratath deerga karai,( 2 / 2 ) ම්ට්ව් / සිරස ට එරෙහිව පනව එති වාරන නියෝගය කෝලම්බ දිස අද්හිකරනයෙන් තවදුරටත් දීර්ග කරඉ,MTV/සිරස ට එරෙහිව පනවා ඇති වාරණ නියෝගය කොළඹ දිසා අධිකරණයෙන් තවදුරටත් දීර්ඝ
george steuart health samagamata ha ehi sabapathita apahasa wana lesa puwath pala kireema walakwalamin(1/2),ගෙඕර්ගෙ ස්ටෙඋඅර්ට් හේල්ත් සමගමට හා එහි සබපතිට අපහස වන ලෙස පුවත් පල කිරීම වලක්වලමින් ( 1 / 2 ),George Steuart Health සමාගමට හා එහි සභාපති ට අපහාස වන ලෙස පුවත් පළකිරීම වළකමින්
"kadawatha, kirillawala pradeshayedi lorry rathayak anathurakata lak weema hethuwen, colamba - nuwara pare ratha-wahana thada-badayak.: police","කදවත , කිරිල්ලවල ප්‍රදෙශයෙදි ලෝර්ර්ය් රතයක් අනතුරකට ලක් වීම හෙතුවෙන් , කෝලම්බ - නුවර පරෙ රත - වහන තද - බදයක් .: පෝලිකෙ",කඩවත කිරිල්ලවල ප්‍රදේශයේදී ලොරි රථයක් අනතුරට ලක්වීම හේතුවෙන් කොළඹ කොළඹ නුවර පාරේ රථවාහන තදබදයක් police
"sl - kodew 3 ekdina tharagaya; kodewwanta kadulu 5 ka jayak. sl-274/6(50) , kodew-276/5 (48.3) -  kodewwanta tharagawaliya 3-0 lesa jaya","ස්ල් - කෝදෙව් 3 එක්දින තරගය ; කෝදෙව්වන්ට කදුලු 5 ක ජයක් . ස්ල් - 274 / 6 ( 50 ) , කෝදෙව් - 276 / 5 ( 48 . 3 ) - කෝදෙව්වන්ට තරගවලිය 3 - 0 ලෙස ජය",SL කොදෙව්  3 එක්දින තරගය කොදෙව්වන්ට ලකුණු 5ක ජය SL-274/6(50)කොදෙව් 276/5 (48.3) කොදෙව්වන්ට තරඟාවලිය 3-0 ලෙස ජය
"3rd odi, sri lanka vs west indies ' antigua l wi kandayamata kadulu 05ka jayak. (3-0) sl 274/6(50) wi 276/5(48.3), bravo 102(132), lakmal 56/2","3ර්ද් ඕදි , ශ්‍රී ලන්ක ව්ස් වෙස්ට් ඉන්දීස් ' අන්ටිගුඅ ල් වි කන්දයමට කදුලු 05ක ජයක් . ( 3 - 0 ) ස්ල් 274 / 6 ( 50 ) වි 276 / 5 ( 48 . 3 ), බ්‍රවෝ 102 ( 132 ), ලක්මල් 56 / 2","3rd ODI, Sri Lanka Vs West Indies ' Antigua l WI කණ්ඩායමට කඩුලු 05 ජයක් (3-0) SL 274/6(50) WI 276/5(48.3), Bravo 102(132), ලක්මාල්  56/2"
