singlish_content,transliterated_L1,man_written
"update - cid athadanguwata path azath salley-ge motor rathaye thibi, vides rataka nishpaditha pistholayak soya-gane.: police spokesman","update - කිද් අතදන්ගුවට පත් අzඅත් සල්ලෙය් - ගෙ මෝටෝර් රතයෙ තිබි , විදෙස් රටක නිශ්පදිත පිස්තෝලයක් සෝය - ගනෙ .: පෝලිකෙ ස්පෝකෙස්මන්",Update : CID අත්අඩංගුවට පත් අසාත් සාලිගේ මෝටර් රථයේ තිබී විදෙස් රටක නිෂ්පාදිත පිස්තෝලයක් සොයාගැනේ police spokesman
(2/2)nalaka edirisinghe ada kotuwa mahesthrath adhikaranaya hamuwata,( 2 / 2 ) නලක එදිරිසින්ග්හෙ අද කෝටුව මහෙස්ත්‍රත් අද්හිකරනය හමුවට,(2/2)නාලක එදිරිසිංහ අද කොටුව මහේස්ත්‍රාත් අධිකරණය හමුවට
"athadanguwata gath swarnamahal jewellers hi hitapu adyakshawarun wana jeewaka edirisinghe, anjalee edirisinghe asanka edirisinghe ha(1/2)","අතදන්ගුවට ගත් ස්වර්නමහල් ජෙවෙල්ලෙර්ස් හි හිටපු අද්යක්ශවරුන් වන ජීවක එදිරිසින්ග්හෙ , අන්ජලී එදිරිසින්ග්හෙ අසන්ක එදිරිසින්ග්හෙ හා ( 1 / 2 )",අත්අඩංගුවට ගත් සරණ මහා ජුවලර්ස් යි හිටපු අධ්‍යක්ෂකවරුන් වන ජීවක එදිරිසිංහ අන්ජලී එදිරිසිංහ අසංක එදිරිසිංහ හා (1/2)
randawagena prashna karana hitapu andukara azath sally ge motor rathaye thibee vides rataka nishpaditha pistholayak cid ya soya ganne,රන්දවගෙන ප්‍රශ්න කරන හිටපු අන්දුකර අzඅත් සල්ල්ය් ගෙ මෝටෝර් රතයෙ තිබී විදෙස් රටක නිශ්පදිත පිස්තෝලයක් කිද් ය සෝය ගන්නෙ,රඳවාගෙන ප්‍රශ්න කරන හිටපු ආණ්ඩුකාර අසාත් සාලිගේ මෝටර් රථයේ තිබී විදෙස් රටක නිෂ්පාදිත පිස්තෝලයක් CID සොයා ගැනේ
rs.miliyana 20 ka heroin 2kg samaga pudgalayeku rajagairiye dee stf athadanguwata,ර්ස් . මිලියන 20 ක හෙරෝඉන් 2ක්ග් සමග පුද්ගලයෙකු රජගඉරියෙ දී ස්ට්f අතදන්ගුවට,Rs මිලියන 20ක හා හෙරොයින් 2kg සමග සමඟ පුද්ගලයෙකු රාජගිරියේ දී STF අත්අඩංගුවට
stf rajagiriye kala wetalimakin rs.koti 02ta adika watinakamin yuth heroin 2kg k samaga sekakaruweku athadanguwata.-stf,ස්ට්f රජගිරියෙ කල වෙටලිමකින් ර්ස් . කෝටි 02ට අදික වටිනකමින් යුත් හෙරෝඉන් 2ක්ග් ක් සමග සෙකකරුවෙකු අතදන්ගුවට .- ස්ට්f,STF රාජගිරියේ දී කළ වැටලීමකින් rs කෝටි 2කට අධික වටිනාකමකින් යුතු හෙරොයින් සමග  සැකකරුවෙකු අත්අඩංගුවට STF
update: thawath covid-19 asadithayin 120 deneku haduna ganne.ada wartha wu asadithayin ganana 274 dakwa ihalata - yuda hamudapathi,update : තවත් covid - 19 අසදිතයින් 120 දෙනෙකු හදුන ගන්නෙ . අද වර්ත වු අසදිතයින් ගනන 274 දක්වා ඉහලට - යුද හමුදපති,Update : තවත් covid 19  ආසාදිතයින් 120 දෙනෙකු හඳුනා ගැනේ අද වාර්තා වූවා වූ ආසාදිතයින් ගණන 274 දක්වා ඉහලට යුද හමුදා පති
covid-19 asaditha marana 02 k ada wartha weemath samaga merata samastha marana 534 dakwa ihalata - saukya amathyanshaya,covid - 19 අසදිත මරන 02 ක් අද වර්ත වීමත් සමග මෙරට සමස්ත මරන 534 දක්වා ඉහලට - සෞක්ය අමත්යන්ශය,covid 19 ආසාදිත මරණ මරණ 2ක් අද වාර්තා වාර්තා වීමත් සමග මෙරට සමස්ත මරණ 534 දක්වා ඉහළට සෞඛ්‍ය අමාත්‍යාංශය
palath sabha jandaya kadinamin pewethweemata janadhipathiwaraya  sagama pewathi sakachchawedi.. (1/2),පලත් සබ්හ ජන්දය කදිනමින් පෙවෙත්වීමට ජනද්හිපතිවරය සගම පෙවති සකච්චවෙදි .. ( 1 / 2 ),පළාත් සභා ඡන්දය කඩිනමින් පැවැත්වීමට ජනාධිපතිවරයා සමග පැවති සාකච්ඡාවේදී (1/2)
.andu paksha nayakainge ekagathawaya palawu bawa cabinet prakashaka amathya  keheliya rambukwella kiyai.(2/2),. අන්දු පක්ශ නයකඉන්ගෙ එකගතවය පලවු බව කබිනෙට් ප්‍රකශක අමත්ය කෙහෙලිය රම්බුක්වෙල්ල කියඉ .( 2 / 2 ),ආණ්ඩු පක්ෂ නායකයින්ගේ එකඟතාවය  පළවූ බව කැබිනට් ප්‍රකාශක  අමාත්‍ය කෙහෙළිය රඹුක්වැල්ල කියයි
update: thrasthawadaya walakweeme panathe vidiwidana yatathe azath sally randawagena prashna kere - police maadya prakashaka,update : ත්‍රස්තවදය වලක්වීමෙ පනතෙ විදිවිදන යටතෙ අzඅත් සල්ල්ය් රන්දවගෙන ප්‍රශ්න කෙරෙ - පෝලිකෙ මාද්ය ප්‍රකශක,Update : ත්‍රස්තවාදය වැළැක්වීමේ පනතේ විධිවිධාන යටතේ අසාත් සාලි රඳවාගෙන ප්‍රශ්න කෙරේ police  මාධ්‍ය ප්‍රකාශක
thawath corona asadithain 154k handuna gene.-rajaye prauththi departhamenthuwa,තවත් කෝරෝන අසදිතඉන් 154ක් හන්දුන ගෙනෙ .- රජයෙ ප්‍රෞත්ති දෙපර්තමෙන්තුව,තවත් කොරෝනා ආසාදිතයින් 154ක් හඳුනාගැනේ රජයේ ප්‍රවෘත්ති දෙපාර්තමේන්තුව
update:cid athadanguwata patj azath salley thrasthawadaya welekweeme panatha yatathe randawa thaba wimarshanaya kirimata piyawara.-police madya prakashaka,update : කිද් අතදන්ගුවට පට්ජ් අzඅත් සල්ලෙය් ත්‍රස්තවදය වෙලෙක්වීමෙ පනත යටතෙ රන්දව තබ විමර්ශනය කිරිමට පියවර .- පෝලිකෙ මද්ය ප්‍රකශක,Update : CID අත්අඩංගුවට අසාත් සාලි ත්‍රස්තවාදය වැළකීමේ පනත යටතේ රඳවා තබා විමර්ශනය කිරීමට පියවර police  මාධ්‍ය ප්‍රකාශක
basnahira palath hitapu andukara azath salley kollupitiyedi cid athadanguwata.,බස්නහිර පලත් හිටපු අන්දුකර අzඅත් සල්ලෙය් කෝල්ලුපිටියෙදි කිද් අතදන්ගුවට .,බස්නාහිර පළාත් හිටපු ආණ්ඩුකාර අසාද් සාලි කොල්ලුපිටියේ දී සීයයි CID අත්අඩංගුවට
neethipathi upades matha hitapu andukara azath sally cid athadanguwata,නීතිපති උපදෙස් මත හිටපු අන්දුකර අzඅත් සල්ල්ය් කිද් අතදන්ගුවට,නීතිපති උපදෙස් මත හිටපු ආණ්ඩුකාර අසාද් සාලි CID අත්අඩංගුවට
covid-19 asadithayin 154 deneku haduna ganne - yuda hamudapathi,covid - 19 අසදිතයින් 154 දෙනෙකු හදුන ගන්නෙ - යුද හමුදපති,Covid 19 ආසාදිතයින් 154 දෙනෙකු හඳුනා ගනී යුද හමුදා පති
talaimannarama dumriya haras maargayakadi magee bus rathayak ha dumriyak gateemen wu anathurakin 09 hawiridi sisuweku miyayai.thawath 15 denekuta thuwala,ටලඉමන්නරම දුම්‍රිය හරස් මාර්ගයකදි මගී බුස් රතයක් හා දුම්‍රියක් ගටීමෙන් වු අනතුරකින් 09 හවිරිදි සිසුවෙකු මියයඉ . තවත් 15 දෙනෙකුට තුවල,තලෙයිමන්නාරම දුම්රිය හරස් මාර්ගය කදී මගකදී මගී බස් රථයක් හා දුම්රියක් ගැටීමෙන් වූ අනතුරකින් 9 හැවිරිදි සිසුවකු මියයයි තවත් 15 දෙනෙකු තුවාල
dahampasal shreni wibhaga labana may 09 dakwa kal dame.- baudha katayuthu comasaris genaral.,දහම්පසල් ශ්‍රෙනි විබ්හග ලබන මය් 09 දක්වා කල් දමෙ .- බෞද්හ කටයුතු කෝමසරිස් ගෙනරල් .,දහම් පාසල් ශ්‍රේණි විභාග ලබන මැයි 9 දක්වා කල් දැමේ කල් දැමේ බුද්ධ කටයුතු කොමසාරිස් ජනරාල්
(2/2)eya sakachcha wemin pawathina hudek yojanawak pamanak bawa videsha lekam kiyai,( 2 / 2 ) එය සකච්ච වෙමින් පවතින හුදෙක් යෝජනවක් පමනක් බව විදෙශ ලෙකම් කියඉ,(2/2) එය සාකච්ඡා වෙමින් පවතින හුදෙක් යෝජනාවක් පමණක් බව විදේශ ලේකම් කියයි
"burkawa ha nikabaya peladima thahanam kirimata rajaya thiranayak gena nomethi bawath, eya hudek yojanawak pamanak bawath widesha katayuthu amathyanshaya kiyai.","බුර්කව හා නිකබය පෙලදිම තහනම් කිරිමට රජය තිරනයක් ගෙන නෝමෙති බවත් , එය හුදෙක් යෝජනවක් පමනක් බවත් විදෙශ කටයුතු අමත්යන්ශය කියඉ .",බුර්කාව හා නිකාබය පැළඳීම තහනම් කිරීමට රජය තීරණයක් ගෙන නොමැති බවත් එය හුදෙක් යෝජනාවක් පමණක් බවත් විදේශ කටයුතු අමාත්‍යංශය කියයි
merata burqawa ho niqabaya peladeemata thahanamak penaweema sadaha rajaya theeranayak gena nomethi athara(1/2),මෙරට බුර්qඅව හෝ‍ නිqඅබය පෙලදීමට තහනමක් පෙනවීම සදහ රජය තීරනයක් ගෙන නෝමෙති අතර ( 1 / 2 ),මෙරට බුරුකාව හෝ නිකාබය පැළඳීමට තහනමක් පැනවීම සඳහා රජය තීරණයක් ගෙන නොමැති අතර
thaleimannaramedi magi bus rathayak dumriyaka getimen 09 hewiridi pasal daruweku maruta.15 denekuta thuwala.- police madya prakashaka,තලෙඉමන්නරමෙදි මගි බුස් රතයක් දුම්‍රියක ගෙටිමෙන් 09 හෙවිරිදි පසල් දරුවෙකු මරුට . 15 දෙනෙකුට තුවල .- පෝලිකෙ මද්ය ප්‍රකශක,තලෙයි මන්නාරමේ දී මගී බස් රථයක් දුම්රියක ගැටීමෙන් 9 හැවිරිදි පාසල් දරුවෙකු මරුට 15 දෙනෙකුට තුවාල පොලිස් මාධ්‍ය ප්‍රකාශක
(2/2)asanka edirisinghe ha nalaka edirisinghe cid athadanguwata,( 2 / 2 ) අසන්ක එදිරිසින්ග්හෙ හා නලක එදිරිසින්ග්හෙ කිද් අතදන්ගුවට,අසංක එදිරිසිංහ හා නාලක එදිරිසිංහ CID අත්අඩංගුවට
"neethipathi upades matha swarnamahal jewellers hitapu adyakshawarun wana jeewaka edirisinghe, anjalee edirisinghe(1/2)","නීතිපති උපදෙස් මත ස්වර්නමහල් ජෙවෙල්ලෙර්ස් හිටපු අද්යක්ශවරුන් වන ජීවක එදිරිසින්ග්හෙ , අන්ජලී එදිරිසින්ග්හෙ ( 1 / 2 )",නීතිපති උපදෙස් මත ස්වර්ණමහල්  jewellers හිටපු අධ්‍යක්ෂවරුන් වන ජීවක ඉදිරිසිංහ අන්ජලී එදිරිසිංහ
"covid-19 asadithayin 402 deneku suwaya labai.merata suwaya labaa rohalwalin pitawa giya samastha ganana 85,371 dakwa ihalata - saukya amathyanshaya","covid - 19 අසදිතයින් 402 දෙනෙකු සුවය ලබඉ . මෙරට සුවය ලබා රෝහල්වලින් පිටව ගිය සමස්ත ගනන 85 , 371 දක්වා ඉහලට - සෞක්ය අමත්යන්ශය",Covid 19 ආසාදිතයින් 402 දෙනෙකු සුවය ලබයි .මෙරට සුවය ලබා රෝහල්වලින් පිටව ගිය සමස්ත ගණන 85 371 දක්වා ඉහලට සෞඛ්‍ය අමාත්‍යාංශය
amerikanu dollarayata sapekshawa sri lanka rupiyale agaya thawaduratath pahalata.amerikanu dollarayaka wikunum mila rs.200.06 - cbsl,අමෙරිකනු දෝල්ලරයට සපෙක්ශව ශ්‍රී ලන්ක රුපියලෙ අගය තවදුරටත් පහලට . අමෙරිකනු දෝල්ලරයක විකුනුම් මිල ර්ස් . 200 . 06 - ක්බ්ස්ල්,ඇමරිකානු  ඩොලරයට සාපේක්ෂව ශ්‍රී ලංකා රුපියලේ අගය තවදුරටත් පහළට ඇමරිකානු ඩොලරයක  විකුනුම් මිල Rs.200.06-CBSL
antigua hidee pasugiya irida batahira kodew kandayamata erehiwa pewathi 3 ekdina tharagaye dee mandagamee panduwara wegayak(1/2),අන්ටිගුඅ හිදී පසුගිය ඉරිද බටහිර කෝදෙව් කන්දයමට එරෙහිව පෙවති 3 එක්දින තරගයෙ දී මන්දගමී පන්දුවර වෙගයක් ( 1 / 2 ),Antigua හි දී පසුගිය ඉරිදා බටහිර කොදෙව් කණ්ඩායමට එරෙහිව පැවැති 3 එක්දින තරගයේදී මන්දගාමී පන්දු වාරයක්
(2/2)pawathwagena yaama nisa sri lanka kandayamata tharaga gasthuwen 40% ka dhadayak niyama karai - icc,( 2 / 2 ) පවත්වගෙන යාම නිසා ශ්‍රී ලන්ක කන්දයමට තරග ගස්තුවෙන් 40 % ක ද්හදයක් නියම කරඉ - ඉක්ක්,පවත්වාගෙන යාම නිසා ශ්‍රී ලංකා කණ්ඩායමට තරඟ ගාස්තුවෙන් 40%ක දඩයක් නියම කරයි - ICC
indiyawe adani samagama hemikaru gautam adani sri lanka rajayata sthuthiya pala karai.(2/2),ඉන්දියවෙ අදනි සමගම හෙමිකරු ගෞටම් අදනි ශ්‍රී ලන්ක රජයට ස්තුතිය පල කරඉ .( 2 / 2 ),ඉන්දියාවේ Adani සමාගම හිමිකරු Gautam Adani ශ්‍රී ලංකා රජයට ස්තුතිය ස්තුතිය පළ කරයි
colomba waraye batahira paryanthaya godanegeema sadaha tamanta awasthawa laba deema pilibada.. (1/2),කෝලෝම්බ වරයෙ බටහිර පර්යන්තය ගෝදනෙගීම සදහ ටමන්ට අවස්තව ලබ දීම පිළිබඳ .. ( 1 / 2 ),කොළඹ වරාය බටහිර පර්යන්තය ගොඩනැගීම සඳහා තමාට අවස්ථාව ලබාදීම පිළිබඳ
sinharaja wanantharaye gas kepu sekakaruwan 4 deneku stf atthadanguwata.-police.,සින්හරජ වනන්තරයෙ ගස් කෙපු සෙකකරුවන් 4 දෙනෙකු ස්ට්f අට්තදන්ගුවට .- පෝලිකෙ .,සිංහරාජ වනාන්තරයේ ගස් කැපූ සැකකරුවන් 4 දෙනෙකු STF අත්අඩංගුවට police
vee alewi mandalaya goveengen miladee ganna vee thoga sahal bawata path kara akandawa(1/2),වී අලෙවි මන්දලය ගෝවීන්ගෙන් මිලදී ගන්න වී තෝග සහල් බවට පත් කර අකන්දව ( 1 / 2 ),වී අලවි මන්ඩලයේ ගොවීන්ගෙන් මිලදී ගන්නා වී තොග සහල් බවට පත්කර අඛණ්ඩව
(2/2)sathosa shaka jaalaya magin kadinamin beda hareemata amathya mandalaya theeranaya karai,( 2 / 2 ) සතෝස ශක ජාලය මගින් කදිනමින් බෙද හරීමට අමත්ය මන්දලය තීරනය කරඉ,සතොස ශාඛා ජාලය මගින් කඩිනමින් බෙදාහැරීමට අමාත්‍ය මණ්ඩලය තීරණය කරයි
"yuda hamuda buddi anshaya labadun thorathurakata anuwa,rs.5000 wyaja mudal nottu 124k samaga sakakaruwan 02k oluwil pradeshayedi athadanguwata.police","යුද හමුද බුද්දි අන්ශය ලබදුන් තෝරතුරකට අනුව , ර්ස් . 5000 ව්යජ මුදල් නෝට්ටු 124ක් සමග සකකරුවන් 02ක් ඕලුවිල් ප්‍රදෙශයෙදි අතදන්ගුවට . පෝලිකෙ",යුද හමුදා බුද්ධි අංශය ලැබුණු තොරතුරකට අනුව Rs.5000 වටිනා මුදල් නෝට්ටු 124ක් සමග සැකකරුවන් 02ක් ඔලුවිල් ප්‍රදේශයේදී අත්අඩංගුවට police
"yuda hamuda buddhi thorathurakata kala wetalaeemakadi rs.5000 wayaja mudal nottu 124 k samaga pudgalayin dedeneku akkaraipattu, oluwil hidee athadanguwata","යුද හමුද බුද්ද්හි තෝරතුරකට කල වෙටලඊමකදි ර්ස් . 5000 වයජ මුදල් නෝට්ටු 124 ක් සමග පුද්ගලයින් දෙදෙනෙකු අක්කරඉපට්ටු , ඕලුවිල් හිදී අතදන්ගුවට",යුද හමුදා බුද්ධි තොරතුරකට කළ වැටලීමකදී Rs.5000 වටිනා මුදල් නෝට්ටු 124ක් සමඟ පුද්ගලයෙකු අක්කරේපත්තු ඔලුවිල් හිදී අත්අඩංගුවට
"colamba - wellaveediya pradeshayedi narcotics niladarin sidu-kala wetalimakin, ice mathdrawya 1kg samaga sekakaruwan 02-k(29,37) athadanguwata","කෝලම්බ - වෙල්ලවීදිය ප්‍රදෙශයෙදි නර්කෝටික්ස් නිලදරින් සිදු - කල වෙටලිමකින් , ඉකෙ මත්ද්‍රව්ය 1ක්ග් සමග සෙකකරුවන් 02 - ක් ( 29 , 37 ) අතදන්ගුවට","කොළඹ වේල්ලවීදිය ප්‍රදේශයේ දී narcotic නිලධාරීන් සිදුකළ සිදු කළ වැටලීමකින් ICE මත්ද්‍රව්‍ය 1kg සමග සැකකරුවන්  02ක්(29,37)අත්අඩංගුවට"
thawath corona asadithain 70k handuna gene. ada dina wartha wu asadithain sankyawa 248k.- rajaye prauththi departhamenthuwa,තවත් කෝරෝන අසදිතඉන් 70ක් හන්දුන ගෙනෙ . අද දින වර්ත වු අසදිතඉන් සන්ක්යව 248ක් .- රජයෙ ප්‍රෞත්ති දෙපර්තමෙන්තුව,තවත් කොරෝනා ආසාදිතයින් 70ක් හඳුනාගැනීම අද දින වාර්තා වූ ආසාදිතයින් සංඛ්‍යාව 248ක් රජයේ ප්‍රවෘත්ති දෙපාර්තමේන්තුව
update: thawath covid-19 asadithayin 70 deneku haduna ganne.ada wartha wu asadithayin ganana 248 dakwa ihalata - yuda hamudapathi,update : තවත් covid - 19 අසදිතයින් 70 දෙනෙකු හදුන ගන්නෙ . අද වර්ත වු අසදිතයින් ගනන 248 දක්වා ඉහලට - යුද හමුදපති,Update : තවත් covid 19 ආසාදිතයින් 70 දෙනෙකු හඳුනා ගැනේ අද වාර්තා වූ ආසාදිතයින් ගණන  248 දක්වා ඉහලට යුද හමුදා පති
update - thawath covid-19 asadithayin 70k wartha wei.: army commander,update - තවත් covid - 19 අසදිතයින් 70ක් වර්ත වෙඉ .: army commander,Update : තවත් covid 19  ආසාදිතයින් 70ක් වාර්තාවේ army commander
covid-19 asaditha marana 05 k ada wartha weemath samaga merata samastha marana 532 dakwa ihalata - saukya amathyanshaya,covid - 19 අසදිත මරන 05 ක් අද වර්ත වීමත් සමග මෙරට සමස්ත මරන 532 දක්වා ඉහලට - සෞක්ය අමත්යන්ශය,Covid 19 ආසාදිත  මරණ 05ක් අද වාර්තාවීමත් සමඟ මෙරට සමස්ත මරණ දක්වා ඉහලට සෞඛ්‍ය අමාත්‍යාංශය 532 දක්වා ඉහලට සෞඛ්‍ය අමාත්‍යාංශය
thawath covid-19 marana 05k wartha-wei; samastha marana 532 dakwa ihalata.: information department,තවත් covid - 19 මරන 05ක් වර්ත - වෙඉ ; සමස්ත මරන 532 දක්වා ඉහලට .: ඉන්fඕර්මටිඕන් දෙපර්ට්මෙන්ට්,තවත් Covid 19 මරණ 05ක් වාර්තාවේ සමස්ත මරණ 532 දක්වා ඉහලට information department
thawath corona asadithain 178k handuna gene.- rajaye prauththi departhamenthuwa,තවත් කෝරෝන අසදිතඉන් 178ක් හන්දුන ගෙනෙ .- රජයෙ ප්‍රෞත්ති දෙපර්තමෙන්තුව,තවත් කොරෝනා ආසාදිතයින් 178ක් හඳුනාගැනී රජයේ ප්‍රවෘත්ති දෙපාර්තමේන්තුව
"wathu kamkaru dainika wetupa rupiyal 1,000k bawata path karamin nikuth kala gazzte niwedanaya balarahitha karana lesa illa..(1/2)","වතු කම්කරු දඉනික වෙටුප රුපියල් 1 , 000ක් බවට පත් කරමින් නිකුත් කල ගzzටෙ නිවෙදනය බලරහිත කරන ලෙස ඉල්ල ..( 1 / 2 )",වතු කම්කරු දෛනික වැටුප රුපියල්  1000ක් බවට පත් කරමින් නිකුත් කළ ගැසට් නිවේදනය බලරහිත කරන ලෙස ඉල්ලා
..wewili samagam 20k abhiyachanadhikaranayata rit agcha pethsamak gonu karai.(2/2),.. වෙවිලි සමගම් 20ක් අබ්හියචනද්හිකරනයට රිට් අග්ච පෙත්සමක් ගෝනු කරඉ .( 2 / 2 ),වැවිලි සමාගම් 20ක් අභියාචනාධිකරණයට රිට් ආඥා ආඥා පෙත්සමක් ගොනු කරයි
